date;retweets;favorites;text;sentiment;polarity;subjectivity
2018-12-21 23:02;112;456;Coinbase CEO @ brian_armstrong sat down with @ cdixon, @ a16z general partner and Coinbase board member, to discuss the state of crypto, emerging technologies, and the future.https://youtu.be/Bx78aNxwA1E;negative;-0.052777777777777785;0.3944444444444445
2018-12-21 21:02;46;289;We're also donating $25k worth of Bitcoin to help more than 60 survivors of domestic violence through @ GiveCrypto's partnership with @ freefromorg. This gift enables FreeFrom to support people in abusive situations with discreet cash aid.;positive;0.26666666666666666;0.2333333333333333
2018-12-21 21:02;103;448;On Day 12 of 12 Days of Coinbase, we're making gifts to support crypto and blockchain education. We're supporting @ udacity Blockchain Developer Nanodegree scholarships for @ recodedofficial @ techqueriaSF and @ CodeToInspire members. Learn more here:https://bit.ly/2EdaAj1;positive;0.375;0.375
2018-12-21 20:20;131;403;Introducing Dexter, our forensics framework developed for high-security environments. If you're interested in learning how Coinbase keeps its platform secure, check it out!https://blog.coinbase.com/introducing-dexter-b41d28f992b9 …;positive;0.25;0.4666666666666666
2018-12-20 21:01;60;248;Those in Andorra, Gibraltar, Guernsey, Iceland, Isle of Man, and Lithuania now have access to http://Coinbase.com and iOS and Android apps.;neutral;0.0;0.0
2018-12-20 21:01;264;1026;Today, we’re taking another stride toward realizing our mission of creating an open financial system for the world by announcing the rollout of Coinbase to 6 additional markets around the world. Learn more here: https://bit.ly/2T3lQCS It's Day 11 of 12 Days of Coinbase.pic.twitter.com/n235o22uyn;positive;0.16666666666666666;0.3333333333333333
2018-12-19 21:17;57;307;Our goal is to make blockchain technology more accessible, both in the sense of making cryptocurrencies easier to obtain and easier to understand. Over time, we plan to add more kinds of tasks and the ability to earn other cryptocurrencies.https://bit.ly/2GsBTID;positive;0.3125;0.4375
2018-12-19 21:17;63;347;In this initial phase, we’re launching in invite-only mode with educational content about one asset: ZRX. While earning is invite-only to start, everyone has immediate access to the educational content and can join the waitlist to request an invite.pic.twitter.com/ZqqVs6UUPq;positive;0.16666666666666666;0.16666666666666666
2018-12-19 21:17;706;2254;Today, we're launching Coinbase Earn, a new way to earn crypto while learning about digital assets. With Coinbase Earn, the idea is for users to learn about an asset’s utility and its underlying technology, while getting a bit of the asset to try out. https://blog.coinbase.com/earn-cryptocurrency-while-learning-about-new-digital-assets-cc2df3537fc7 …pic.twitter.com/cWa8RTDGuA;positive;0.06818181818181818;0.22727272727272727
2018-12-19 19:56;355;1287;Earlier this month, Coinbase moved 5% of all BTC, 8% of all ETH, and 25% of all LTC in circulation to our next-gen secure cold storage. Here’s how we did it.https://blog.coinbase.com/a-behind-the-scenes-look-at-the-biggest-and-quietest-crypto-transfer-on-record-682ff4a6d9e4 …;negative;-0.06666666666666665;0.7000000000000001
2018-12-19 00:40;73;375;How we came to create Coinbase Learn, an educational resource derived from insights directly from our customers.https://blog.coinbase.com/behind-coinbase-learn-an-exercise-in-listening-to-our-customers-8deeee0f1f92 …;positive;0.175;0.325
2018-12-18 20:57;47;175;As we continue to add support for more assets, here's a reminder of how we think about which assets get listed on Coinbase and Coinbase Pro:https://blog.coinbase.com/coinbase-is-for-everyone-coinbase-pro-is-for-experts-a1aca322291b …;positive;0.5;0.5
2018-12-18 20:50;95;392;Today is Day 9 of 12 Days of Coinbase. Learn more here: https://bit.ly/2EdaAj1 https://twitter.com/CoinbasePro/status/1075114873636368385 …;positive;0.5;0.5
2018-12-18 19:29;153;472;How do we keep the U.S. at the heart of a more open and equitable financial system? Brian Brooks, the Chief Legal Officer at Coinbase, details in @ DealBook how American blockchain innovation is vital to providing a check on de-dollarization.https://www.nytimes.com/2018/12/18/business/dealbook/digital-reserve-currency.html …;positive;0.13333333333333333;0.26666666666666666
2018-12-17 21:05;71;430;Conversions complete instantly and at a lower cost than if done via two separate transactions. We’ll be gradually rolling out the ability to convert cryptocurrencies to customers in all 34 countries in which Coinbase offers native payment access.;positive;0.06666666666666667;0.35555555555555557
2018-12-17 21:05;797;2398;Starting today, you can convert one crypto to another on Coinbase. Conversions are available between Bitcoin (BTC) and Ethereum (ETH), Ethereum Classic (ETC), Litecoin (LTC), 0x (ZRX), or Bitcoin Cash (BCH). It's Day 8 of 12 Days of Coinbase. Learn more: https://bit.ly/2C2KYUo pic.twitter.com/wLyJPfkKcA;positive;0.26666666666666666;0.29166666666666663
2018-12-16 21:19;57;190;Unlike bitcoin or ether, a USDC is meant to represent a single US dollar (USD) that does not move up or down relative to its reference currency. One USDC is a 1:1 representation of a US dollar on the Ethereum blockchain.https://youtu.be/A9wLulYoDag;negative;-0.07566137566137567;0.16772486772486772
2018-12-16 21:19;166;558;Coinbase offers support for the USDC stablecoin ($USDC), and Coinbase customers in supported jurisdictions can buy, sell, send, and receive USDC. On Day 7 of 12 Days of Coinbase, we are launching an educational resource. https://bit.ly/2C2KYUo;positive;0.175;0.125
2018-12-15 21:06;39;235;Our $10,000 gift in Bitcoin ($BTC) allows http://GiveCrypto.org to significantly expand on a model that has already allowed them and partner Sempo to support 15 Yazidi families in Kurdistan and 5 Syrian families in Beirut in 2018.;positive;0.375;0.875
2018-12-15 21:06;177;921;On Day 6 of 12 Days of Coinbase, we're donating $10,000 in $ BTC to @ GiveCrypto in support of Syrian refugees in Greece. Refugee communities often don't have access to financial institutions, and crypto offers the easiest way to give money to those in need https://bit.ly/2EdaAj1 pic.twitter.com/lyIJDQR5wT;positive;0.05;0.0
2018-12-14 23:59;133;602;Our goal is to maintain the trusted experience our customers have come to expect while responding to our #1 customer request: adding assets. Here’s how we think about different Coinbase products serving the range of our customers' needs.https://bit.ly/2QtPAfb;neutral;0.0;0.6
2018-12-14 21:03;1164;3683;Starting today, all Coinbase customers in the U.S. can instantly withdraw Coinbase cash balances to PayPal for no fee. It's Day 5 of 12 Days of Coinbase. Learn more here: https://bit.ly/2EdaAj1 pic.twitter.com/EFHn8LFPTs;positive;0.16666666666666666;0.4222222222222222
2018-12-14 03:16;122;514;"Continuous learning is a core value at Coinbase; we regularly invite in big thinkers to share ideas. Today, @ mwseibel of @ ycombinator spoke to the importance of tuning out hype during cycles in tech: “There’s no use pontificating; let’s just build products people want to use.”pic.twitter.com/OwY3GgG4A1";neutral;0.0;0.08846153846153847
2018-12-13 21:01;115;460;The crypto industry moves fast. It's hard to filter information on the many assets out there. On Day 4 of 12 Days of Coinbase, we're rolling out watchlists so Coinbase customers can customize their dashboards with assets of interest. Learn more: https://bit.ly/2EdaAj1 pic.twitter.com/HjsTCEv1oo;positive;0.22708333333333333;0.5354166666666667
2018-12-13 19:48;77;294;Hypergrowth at Coinbase has presented many opportunities to tackle new scaling challenges, including onboarding engineers in a quick and secure manner. Read more about the Single Sign On system we built to automate user privilege escalation via consensus.https://blog.coinbase.com/single-sign-on-via-consensus-7b3693d43a7c …;positive;0.2997113997113997;0.46147186147186153
2018-12-12 21:22;21;142;It's Day 3 of 12 Days of Coinbasehttps://bit.ly/2EdaAj1;neutral;0.0;0.0
2018-12-12 21:22;471;1303;Our mission is to create an open financial system for the world. We believe this is the best way to bring about more economic freedom, innovation, and equality of opportunity. Today, we're sharing a video explaining how crypto will make this possible.https://youtu.be/IWeCQkIJNkY;positive;0.33999999999999997;0.3
2018-12-11 21:02;73;344;This donation will put $1 USD worth of crypto directly into crypto wallets for 100+ families in Santa Elena de Uairen every day for 3 months. Recipients can purchase food and basic supplies at a local store that accepts payments in crypto.;positive;0.1;0.15625
2018-12-11 21:02;118;563;On Day 2 of 12 Days of Coinbase, we want to highlight incredible work being done by @ GiveCrypto distributing crypto to families in need. In support, we're donating $10,000 in $ ZEC to their project in Venezuela. https://bit.ly/2EdaAj1 pic.twitter.com/yjCP5jHZKl;positive;0.9;0.9
2018-12-11 20:10;16;96;. @ dwr on adding new assets: “With a traditional stock exchange, they list everything above a certain quality bar. And ultimately investors and individuals make decisions on what to invest.”;positive;0.07012987012987013;0.5751948051948051
2018-12-11 20:10;20;119;“Our recent shift in strategy is really driven by customers. When we asked customers the number one thing they want, they told us it’s adding new cryptocurrencies to the platform.”;positive;0.11212121212121212;0.3015151515151515
2018-12-11 20:10;5;30;“In order to have easy onramps into crypto, you still need strong partnerships with traditional financial institutions. We realize from a practical standpoint that’s how you actually get more people access to cryptocurrency.”;positive;0.22777777777777777;0.4861111111111111
2018-12-11 20:10;29;167;Check out @ dwr on trust in the crypto space, listening to customers, and how Coinbase approaches adding new assets. Listen to full @ laurashin Unchained podcast:https://bit.ly/2L8VIDA;positive;0.24318181818181817;0.5022727272727273
2018-12-10 21:08;363;1147;Coinbase customers in the US can now spend crypto balances on @ WeGift e-gift cards—just in time for the holidays. It's Day 1 of 12 Days of Coinbase, a series of announcements we'll make each day until December 21st. Learn more here: https://bit.ly/2EdaAj1 pic.twitter.com/aJpxUEJACm;positive;0.25;0.25
2018-12-07 15:00;44;229;As part of the exploratory process, customers may see public-facing APIs and other signs that we are conducting engineering work to potentially support these assets. We cannot commit to when or whether these assets will become available. Follow http://blog.coinbase.com for updates;positive;0.09166666666666667;0.5916666666666667
2018-12-07 15:00;87;379;Over time, we intend to offer access to 90%+ of all compliant digital assets by market cap. To make this vision a reality, we will use our published Digital Asset Framework to evaluate assets on factors like security, compliance, and technical innovation:https://blog.coinbase.com/new-asset-listing-process-a83ef296a0f3 …;neutral;0.0;0.03333333333333333
2018-12-07 15:00;2268;5717;Coinbase is exploring the addition of 30+ new digital assets. It’s our goal to offer support for all assets that meet our standards and are compliant with local law.https://blog.coinbase.com/coinbase-continues-to-explore-support-for-new-digital-assets-92ba4ab7f465 …;positive;0.04545454545454545;0.15151515151515152
2018-12-07 01:07;30;157;Thread https://twitter.com/balajis/status/1070830209325121536 …;neutral;0.0;0.0
2018-12-05 19:27;274;905;ZEC is now live on Coinbase and in the Android and iOS apps. Coinbase customers can log in now to buy, sell, send, receive, or store ZEC.https://blog.coinbase.com/buy-and-sell-zec-on-coinbase-ccd0bbb642a9 …;positive;0.13636363636363635;0.5
2018-12-05 19:16;44;173;As we make more assets available on Coinbase, we want to help people understand and make informed decisions about cryptocurrency. Check out the ZEC page on Coinbase to learn more about it:https://www.coinbase.com/price/zcash;positive;0.4666666666666666;0.4666666666666666
2018-12-05 19:13;236;734;ZEC is launching on Coinbase and in the iOS and Android apps within the next 15 minutes. You may need to update your app to properly buy and sell ZEC. We will update when ZEC is fully live. https://blog.coinbase.com/buy-and-sell-zec-on-coinbase-ccd0bbb642a9 …http://Coinbase.com;positive;0.04545454545454545;0.19999999999999998
2018-12-04 22:43;97;413;Coinbase CEO @ brian_armstrong talks # crypto 101 with @ joannastern of @ wsj. https://www.wsj.com/video/series/in-the-elevator-with/in-the-elevator-with-coinbase-ceo-brian-armstrong/C475E356-FC15-4B4B-B92A-18C5005F833F …;neutral;0.0;0.0
2018-11-30 04:17;256;809;“Fintech before crypto is like mobile before the iPhone came along.” Watch @ Coinbase COO @ AsiffHirji explain how stablecoins will lead to tech innovation at @ money2020.pic.twitter.com/q4QqqVslw4;neutral;0.0;0.0
2018-11-28 01:47;732;1945;“We’re on the cusp of internet 3.” Watch @ coinbase COO @ asiffhirji explain how crypto is enabling the creation of the decentralized web at @ money2020. “This will solve the two biggest problems with the internet today.”pic.twitter.com/Ek9hywE0Mk;neutral;0.0;0.0
2018-11-15 17:00;137;457;Bitcoin Cash (BCH) sends, receives, buys and sells are now paused. Please follow @ CoinbaseSupport for further BCH fork updates.;neutral;0.0;0.5
2018-11-15 04:02;531;1799;Binance is listing USDC–the stablecoin co-created by @ circlepay and Coinbase via @ centre_io. We co-founded the CENTRE Consortium with the goal of establishing a standard for fiat on the internet, and we’re thrilled to see adoption growing around the world.http://ow.ly/cIlb50jHfU9;positive;0.3;0.35
2018-11-14 07:32;141;409;Update for customers with Bitcoin Cash (BCH) stored on Coinbasehttps://blog.coinbase.com/what-to-expect-during-the-bitcoin-cash-hard-fork-f15fd03687db …;neutral;0.0;0.0
2018-11-09 20:45;177;623;An open financial system was on full display at # devcon4 last week as more than 3,000 developers from around the world came together to explore the toughest challenges in Ethereum and blockchains today. We rounded up a few key takeaways.https://blog.coinbase.com/wrapping-up-devcon4-4de813e718fb …;positive;0.09285714285714285;0.3880952380952381
2018-11-08 21:12;601;1796;BAT is now live at http://Coinbase.com and in the Coinbase iOS and Android apps. Coinbase customers can log in to buy, sell, send, receive, or store BAT.https://blog.coinbase.com/buy-and-sell-bat-on-coinbase-454a7eb9f3a …;positive;0.13636363636363635;0.5
2018-11-08 21:00;48;190;As we make more assets available on Coinbase, we want to help people understand and make informed decisions about cryptocurrency. Check out the BAT page on Coinbase to learn more about it:https://www.coinbase.com/price/basic-attention-token …;positive;0.4666666666666666;0.4666666666666666
2018-11-08 21:00;520;1385;Basic Attention Token (BAT) is launching at http://Coinbase.com and in the iOS and Android apps within the next 15 minutes. You may need to update your app to properly buy and sell BAT. We will update when BAT is fully live. https://blog.coinbase.com/buy-and-sell-bat-on-coinbase-454a7eb9f3a …;positive;0.03409090909090909;0.18125
2018-10-31 20:50;83;329;So much happens in the crypto ecosystem each month that moves the space forward. This Month in Crypto: Take a look at how crypto intersects with @ ChristiesInc, @ VisitSeoul, @ DocuSign, and big agriculture.https://blog.coinbase.com/this-month-in-crypto-icos-christies-and-self-regulation-in-japan-fc5fe0774a63 …;positive;0.1;0.15000000000000002
2018-10-31 14:51;533;1684;10 years ago today, something big happened. We were inspired to take a look back at some of the technologies we now take for granted—in their own early years. # satoshi10year https://blog.coinbase.com/technological-adolescence-ca02c8930a3a …pic.twitter.com/lUEWqIYyKf;positive;0.175;0.35000000000000003
2018-10-31 06:13;223;674;Coinbase COO @ AsiffHirji talks about our near-term plans to accelerate the adoption of crypto.https://twitter.com/BloombergTV/status/1057406798796210176 …;neutral;0.0;0.0
2018-10-30 17:51;1033;2718;At Coinbase, we believe that cryptocurrencies and the technologies that power them represent a breakthrough in computer science that will change both the internet and the global financial system for the better.pic.twitter.com/soaFnatNoH;neutral;0.0;0.0
2018-10-30 13:05;619;2020;We're pleased to announce our latest funding round, led by Tiger Global Management. We plan to accelerate our global expansion and investments in the utility phase of crypto—always working to create a more open financial system for the world. Read more:https://blog.coinbase.com/coinbase-raises-series-e-round-of-financing-to-accelerate-the-adoption-of-cryptocurrencies-1ad927463814 …;positive;0.1625;0.4125
2018-10-30 00:27;106;506;"to @ gladstein of @ HRF for sharing his perspective today @ coinbase on the the potential for crypto to help people who aren't able to rely on a traditional financial system: There are four billion people around the world who probably need it.”pic.twitter.com/Iqhq1i2d3p""";positive;0.125;0.59375
2018-10-23 21:50;96;443;Coinbase Custody will operate as a Limited Purpose Trust Company chartered by the New York Department of Financial Services.;positive;0.021645021645021644;0.19913419913419914
2018-10-23 21:50;1125;3097;Today, we’re proud to announce that Coinbase Custody has obtained a license under New York State Banking Law to operate as an independent Qualified Custodian.https://blog.coinbase.com/coinbase-custody-receives-trust-charter-from-the-new-york-department-of-financial-services-532c92797215 …;positive;0.31212121212121213;0.5265151515151515
2018-10-23 20:41;447;1419;Starting today, Coinbase customers in supported jurisdictions can buy, sell, send, and receive the USDC stablecoin. The advantage of a blockchain-based digital dollar is that it's easier to send, use in decentralized apps, and store locally. Get started: https://bit.ly/2D0ts4L pic.twitter.com/NN2NLY4gwE;neutral;0.0;0.03333333333333333
2018-10-23 18:00;90;474;A blockchain-based digital dollar like USDC is easier to program with, to send quickly, to use in dApps, and to store locally than traditional bank account-based dollars. That's why we think of it as an important step towards a more open financial system.;positive;0.15416666666666667;0.40625
2018-10-23 18:00;957;2329;Coinbase is launching support for the USDC stablecoin. Starting today, Coinbase customers in supported jurisdictions can buy, sell, send, and receive USDC at http://Coinbase.com and in our mobile apps. Learn more here: https://blog.coinbase.com/coinbase-and-circle-announce-the-launch-of-usd-coin-a-digital-dollar-2cd6548d237 …pic.twitter.com/z8fFd8mDYp;positive;0.25;0.3
2018-10-18 20:06;185;611;Today we’re open sourcing Salus, a tool we use at Coinbase to coordinate security scanning across our services. If you run a CI/CD pipeline for fast-moving development, you may want to check it out.https://blog.coinbase.com/introducing-salus-how-coinbase-scales-security-automation-1ba5e8074937 …;neutral;0.0;0.5
2018-10-16 21:28;1063;2979;ZRX is now live at http://Coinbase.com and in the Coinbase iOS and Android apps. Coinbase customers can log in now to buy, sell, send, receive, or store ZRX.https://blog.coinbase.com/buy-and-sell-zrx-on-coinbase-5008286c9d0e …;positive;0.13636363636363635;0.5
2018-10-16 21:12;71;266;As we make more assets available on Coinbase, we want to help people understand and make informed decisions about cryptocurrency. Check out the ZRX page on Coinbase to learn more about it:https://www.coinbase.com/price/0x;positive;0.4666666666666666;0.4666666666666666
2018-10-16 21:12;519;1365;ZRX is launching at http://Coinbase.com and in the iOS and Android apps within the next 15 minutes. You may need to update your app to properly buy and sell ZRX. We will update when ZRX is fully live. https://blog.coinbase.com/buy-and-sell-zrx-on-coinbase-5008286c9d0e …;positive;0.04545454545454545;0.19999999999999998
2018-10-16 01:25;424;1715;Coinbase is expanding its European presence by opening a new office in Dublin. We look forward to tapping into the city's diverse talent pool and contributing to its burgeoning crypto economy.https://blog.coinbase.com/coinbase-expands-with-new-dublin-office-fc2e5ebcbeb6 …;positive;0.06818181818181818;0.22727272727272727
2018-10-15 19:16;84;258;In case you missed # SFBW18 or # EthSanFrancisco, we rounded up a few of the highlights. It was an amazing week of reminders that the open financial system is closer than we think.https://blog.coinbase.com/a-week-of-crypto-in-san-francisco-4502421a59f3 …;positive;0.10000000000000002;0.375
2018-10-09 00:51;146;515;"It's not about trusting no one,"" Coinbase CTO, @ balajis, explained on stage at # SFBW18 today. ""It's about having a greater choice of who to trust with custody of valuable assets.""pic.twitter.com/6VoqfAJjYm""";positive;0.5;0.5
2018-10-04 19:33;295;860;"Blockchain technology is enabling a new financial future, but that doesn’t mean it’s obvious how you get started today. In this edition of # cryptocurious, Coinbase CEO @ brian_armstrong tackles one of the most common questions: “How do you buy bitcoin? https://bit.ly/2PbnkcC pic.twitter.com/MVpOlhY4lL""";positive;0.0034090909090909094;0.3952922077922078
2018-10-03 03:26;134;506;Blockchain transaction fees can be notoriously volatile. Learn how our engineering team is using a technique called Child Pays for Parent to improve the reliability of # Bitcoin transactions for our customers. # CPFPhttps://blog.coinbase.com/improving-bitcoin-reliability-through-child-pays-for-parent-77e771bb04d6 …;neutral;0.0;0.0
2018-10-02 18:55;213;935;We're proud to welcome Chris Dodds of the @ CharlesSchwab Board of Directors to the @ coinbase Board. His deep knowledge of financial services will be an asset as we head into this next chapter for the company and the cryptocurrency industry as a whole.http://ow.ly/hYp250jiJav;positive;0.32;0.45999999999999996
2018-09-30 20:32;376;1198;Our mission is to create an open financial system for the world, and everyone must feel included. Coinbase Learn is a simple, foundational resource to help anyone and everyone educate themselves about crypto. https://bit.ly/2DIyq7E pic.twitter.com/l3N8z7KraV;neutral;0.0;0.28571428571428575
2018-09-29 01:11;610;1945;The journey to an open financial system begins with awareness. That’s why we’re launching informational asset pages for the top 50 crypto assets by market cap. https://bit.ly/2zDrgxq pic.twitter.com/zPBuCmozl2;positive;0.16666666666666666;0.3333333333333333
2018-09-28 23:55;131;421;So much happens in the crypto ecosystem each month that moves the space forward. This Month in Crypto: Take a look at how crypto intersects with @ Dodgers, @ UN_Women, @ Stanford, @ Davos, @ Google and. . . @ SCRABBLE_EAhttp://ow.ly/e1im50jgaGc;positive;0.2;0.2
2018-09-28 09:05;406;1342;As of today, all UK customers now have the ability to deposit and withdraw GBP on Coinbase, Coinbase Pro and Coinbase Prime. If you’re a customer in the UK and don’t see your GBP wallet, check your account settings and make sure your country is set to UK.https://blog.coinbase.com/gbp-rollout-complete-for-all-uk-customers-e939bb347bb1 …;positive;0.5;0.8888888888888888
2018-09-28 05:52;394;1430;Bundles are a new way to buy crypto on Coinbase. You decide how much to spend. We deliver a market-weighted distribution of assets in your wallets. http://ow.ly/VZ5T50jfpxX pic.twitter.com/zhW2Tiw3rO;positive;0.16818181818181818;0.32727272727272727
2018-09-27 21:50;217;712;"Armstrong belongs to a generation of evangelists who view digital currencies, and the blockchain technology on which they’re based, as tools that will make investing, borrowing, and saving money faster, cheaper, and more egalitarian.""— @ FortuneMagazinehttp://fortune.com/longform/coinbase-bitcoin-brian-armstrong/ …""";positive;0.25;0.25
2018-09-27 18:35;315;956;"Think of Coinbase like Yahoo Finance for crypto — you’ll be able to see a description of the [top 50 coins by market cap], links to associated white papers and project websites, historical trading data, and the current market cap.""— @ TheVergehttps://www.theverge.com/2018/9/27/17906388/coinbase-bundle-crypto-index-blockchain …""";positive;0.2;0.305
2018-09-27 18:00;57;228;For people totally new to crypto, we created Coinbase Learn, a dedicated portal to help them find answers to some of their basic crypto questions, like at http://coinbase.com/learn .;positive;0.06818181818181818;0.2897727272727273
2018-09-27 18:00;47;214;We’re also launching asset pages for people to explore and educate themselves about different cryptocurrencies. Check out market cap, volume, prices and more for the top 50 cryptocurrencies by market cap. This resource is available to anyone—not just Coinbase customers.;positive;0.35;0.5
2018-09-27 18:00;36;129;Coinbase Bundle helps take the stress out of choosing your first crypto by offering the option to buy a market-weighted bundle of crypto for as little as $25.;positive;0.03125;0.41666666666666663
2018-09-27 18:00;316;975;We’re rolling out a suite of new features to help people understand, explore, and buy their first cryptocurrency. Learn more about Coinbase Bundle, Coinbase Asset Pages, and Coinbase Learn here:https://bit.ly/2QekNOR;positive;0.29545454545454547;0.4292929292929293
