date;retweets;favorites;text;sentiment;polarity;subjectivity
2018-06-07 00:06;3547;9104;Today we’re excited to announce that we’re on track to become a US-regulated blockchain securities trading venue. We believe this is an important moment not only for Coinbase, but the entire crypto ecosystem.https://blog.coinbase.com/our-path-to-listing-sec-regulated-crypto-securities-a1724e13bb5a …;positive;0.19375;0.84375
2018-06-04 18:27;1163;3697;We're excited to announce that Coinbase is coming to Japan! 私たちCoinbaseは、日本におけるビジネスの展開をお伝えできることを、とても嬉しく思っております。https://blog.coinbase.com/coinbase-is-coming-to-japan-welcomes-fintech-leader-nao-kitazawa-173919de23c8 …;positive;0.46875;0.75
2018-05-24 00:30;434;1589;Excited to welcome the Paradex team to Coinbase!https://twitter.com/ParadexIO/status/999400667780341761 …;positive;0.5875;0.825
2018-05-18 20:48;252;1265;In 2017, the cryptocurrency space experienced unprecedented mainstream awareness and growth that continues today. To meet this demand, we must work every day to provide the best possible customer experience. Our work here is never done. An update:https://blog.coinbase.com/update-our-commitment-to-supporting-coinbase-customers-5d1b82168628 …;positive;0.6;0.775
2018-05-15 14:15;176;561;The cryptocurrency market is maturing rapidly as more institutional participants enter the space. We welcome these developments and believe this suite of products will accelerate the world’s adoption of cryptocurrency by bringing new capital and greater awareness to the space.;positive;0.4840909090909091;0.5886363636363636
2018-05-15 14:13;80;336;Institutions need more than great products, they need great service too. We’re introducing the Coinbase Institutional Coverage Group. Based in our New York City office, this team brings years of relevant institutional experience from NYSE, Morgan Stanley, and the SEC and CFTC.;positive;0.4227272727272727;0.6590909090909091
2018-05-15 14:13;122;376;We are also excited to announce the launch of Coinbase Prime, a new platform designed specifically to provide a suite of tools and services that institutional investors rely on when trading cryptocurrency. Visit: http://prime.coinbase.com pic.twitter.com/hD4hLbB6PI;positive;0.2556818181818182;0.6022727272727273
2018-05-15 14:13;19;127;Coinbase already offers the deepest pool of liquidity to the largest number of participants in the cryptocurrency space. We intend to continue developing this electronic marketplace, known as Coinbase Markets, by opening a new engineering office in Chicago.;positive;0.11818181818181818;0.22727272727272727
2018-05-15 14:13;66;265;Coinbase Custody will launch in partnership with a SEC-regulated broker-dealer. We’re proud to offer Coinbase's cryptocurrency security excellence to leading institutions in the crypto industry starting with our launch partners:pic.twitter.com/8vltOFN6TI;positive;0.4;0.55
2018-05-15 14:13;887;2268;Today we're announcing the Coinbase suite of institutional products. As institutions continue to enter the cryptocurrency market, we are committed to building the products and services that uniquely meet their needs.https://blog.coinbase.com/coinbase-institutional-deea317d23af …;positive;0.375;1.0
2018-05-12 03:08;51;465;We are in the early days of our mission and there is still so much to do. Thank you to everyone who has supported our mission along the way. Special thanks to our more than 20MM customers for inspiring us every day.;positive;0.30952380952380953;0.4619047619047619
2018-05-12 03:08;59;350;The next phase brings real use cases that enable people to use, earn and transact with products like @ CommerceCB, @ toshi and @ earndotcom. We call this the utility phase.;positive;0.1;0.15000000000000002
2018-05-12 03:08;15;123;Over the past six years, we built a bridge between fiat and crypto by creating the easiest, most secure way for anyone to buy and sell crypto. We call this the investment phase.;positive;0.21666666666666667;0.45
2018-05-12 03:08;8;100;We think this is the highest leverage way to bring about more economic freedom, innovation, efficiency and equality of opportunity in the world.;positive;0.35;0.35
2018-05-12 03:08;17;173;Mission statements can be corny, but we really believe in our goal: to create a more open financial system that is accessible to anyone with an internet connection. A more open financial system that is not controlled by any one country or company, like the internet itself.;positive;0.196875;0.321875
2018-05-12 03:08;541;3492;Today is Coinbase’s sixth anniversary. We’re celebrating six incredible years working toward our mission to help create a more open financial system for the world! pic.twitter.com/CSaqnqY5QU;positive;0.35;0.475
2018-05-02 19:16;104;455;Building trust through compliance.https://blog.coinbase.com/building-trust-through-compliance-10d0ee00cff5 …;neutral;0.0;0.0
2018-04-27 22:34;103;587;It's official, @ iano and @ fat, formerly founders of Bumpers, have joined Coinbase. They're bringing deep experience in consumer products and engineering to our team and we couldn't be more thrilled. Welcome!pic.twitter.com/o3ohrONhh9;positive;0.275;0.4
2018-04-25 18:30;119;424;Are you interested in using data to create an open financial network for the world that’s powered by cryptocurrencies? Join us!https://engineering.coinbase.com/how-we-think-about-data-at-coinbase-7b90f67686c8 …;positive;0.08333333333333333;0.3333333333333333
2018-04-20 19:17;187;1085;We’re proud to be named one of the best places to work in the Bay Area. “While most companies will focus on building up themselves, it’s not always the case that a company also has to focus on building up an entire industry along with it.”https://www.bizjournals.com/sanfrancisco/news/2018/04/20/coinbase-is-gaining-currency-as-it-boosts-a-sense.html …;positive;0.575;0.60625
2018-04-17 22:44;177;1098;We’re very proud to announce that Alesia Haas has joined our team as Chief Financial Officer.https://blog.coinbase.com/welcome-alesia-haas-coinbase-chief-financial-officer-427324bb8bd?gi=a37c7287d07b …;positive;0.5;0.5
2018-04-16 18:04;231;977;We’re excited to welcome the @ earndotcom team and @ balajis to Coinbase!https://twitter.com/brian_armstrong/status/985910945615613954 …;positive;0.5875;0.825
2018-04-13 18:35;208;729;We're excited to welcome @ CipherBrowser to Coinbase!https://twitter.com/CipherBrowser/status/984827995603939330 …;positive;0.5875;0.825
2018-04-09 20:07;144;888;We're excited to announce Rachael Horwitz joining Coinbase as Vice President of Communicationshttps://blog.coinbase.com/welcome-rachael-horwitz-coinbase-vice-president-of-communications-17b244320ecd …;positive;0.375;0.75
2018-04-05 23:59;160;461;A reminder for our customers: we will only announce support for new assets on our platforms via our blog and our Twitter account. See Step 3 in our process we published in March 2018. https://blog.coinbase.com/our-process-for-adding-new-assets-to-coinbase-gdax-march-2018-update-c204d76de55d …pic.twitter.com/F5hkXBruCv;positive;0.06818181818181818;0.7272727272727273
2018-04-05 23:55;407;1168;Introducing Coinbase Ventureshttps://blog.coinbase.com/introducing-coinbase-ventures-c67865a1d2fe …;neutral;0.0;0.0
2018-04-05 22:59;596;1195;Adding Support for Bitcoin Forks to Coinbase https://blog.coinbase.com/adding-support-for-bitcoin-forks-to-coinbase-c4bee020898c …pic.twitter.com/UWKnGp7etA;neutral;0.0;0.0
2018-03-27 19:37;5;10;We have a dedicated engineer working on open source contributions to Lightning and we are hiring more people for this team.https://blog.coinbase.com/introducing-the-coinbase-protocol-team-3bc1e9a63614 …;positive;0.25;0.5
2018-03-26 22:09;16;56;Please see our recent post on our current process for adding new assets. https://blog.coinbase.com/our-process-for-adding-new-assets-to-coinbase-gdax-march-2018-update-c204d76de55d …pic.twitter.com/ajZwtnwGCj;positive;0.04545454545454545;0.36818181818181817
2018-03-26 20:58;2860;5890;We’re excited to announce our intention to support the Ethereum ERC20 technical standard for Coinbase in the coming months. We are not announcing support for any specific assets today. https://blog.coinbase.com/adding-erc20-support-to-coinbase-fe9cba6782b …pic.twitter.com/S1tPXJcTGH;positive;0.09375;0.24375
2018-03-19 16:49;2;4;For Canadian customers, we only allow digital currency buys with a debit card. We currently don't have a Canadian bank partner to allow sells. We are working on finding one.;neutral;0.0;0.4666666666666666
2018-03-16 22:10;277;694;2 new blog posts Our process for adding new assets to Coinbase & GDAX https://blog.coinbase.com/our-process-for-adding-new-assets-to-coinbase-gdax-march-2018-update-c204d76de55d … How Coinbase approaches forked and airdropped assetshttps://blog.coinbase.com/how-coinbase-approaches-forked-and-airdropped-assets-926100d2365f …;positive;0.13636363636363635;0.45454545454545453
2018-03-16 17:49;2;41;This is a scam account. Note the misspelled username.pic.twitter.com/KXoutHH8QE;neutral;0.0;0.0
2018-03-16 17:17;231;773;Introducing the Coinbase Protocol Team https://blog.coinbase.com/introducing-the-coinbase-protocol-team-3bc1e9a63614 …;neutral;0.0;0.0
2018-03-14 03:51;260;595;Our written testimony for the Subcommittee on Capital Markets, Securities, and Investmenthttps://blog.coinbase.com/coinbases-written-testimony-for-the-subcommittee-on-capital-markets-securities-and-investment-47f8a260ce41 …;neutral;0.0;0.0
2018-03-12 23:31;424;1346;New tax tools on Coinbase https://blog.coinbase.com/new-tax-tools-on-coinbase-4d2598544d9e …pic.twitter.com/2xku55ew4O;positive;0.13636363636363635;0.45454545454545453
2018-03-08 18:44;5;5;We did! https://blog.coinbase.com/introducing-tina-bhatnagar-walking-the-talk-on-customer-service-d7ba6d2fb0dd … Here's the most recent update:https://blog.coinbase.com/customer-support-update-b91b9d8e6e46 …;positive;0.25;0.375
2018-03-08 18:33;122;600;We're excited to have Eric Scro joining Coinbase as Vice President of Financehttps://blog.coinbase.com/welcome-eric-scro-vice-president-of-finance-for-coinbase-422c97b51bf4 …;positive;0.375;0.75
2018-03-06 23:52;270;869;Our plan for Asset Management: Step 1: offer Coinbase Index Fund to US-resident, accredited investors Step 2: make available to all investors We’re working on launching more funds which cover a broader range of digital assets. Stay tuned.;positive;0.3;0.3
2018-03-06 23:47;140;461;Also announcing: Coinbase Asset Management https://am.coinbase.com/ Coinbase Index https://am.coinbase.com/index;neutral;0.0;0.0
2018-03-06 23:44;1431;3031;Announcing Coinbase Index Fundhttps://blog.coinbase.com/announcing-coinbase-index-fund-3925fbf548db …;neutral;0.0;0.0
2018-03-05 20:42;1001;2164;Our January 4th, 2018 statement continues to stand: we have made no decision to add additional assets to either GDAX or Coinbase. Any statement to the contrary is untrue and not authorized by the company.https://twitter.com/coinbase/status/948995520973889536 …;neutral;0.0;0.0
2018-03-05 16:31;2;5;Thanks, Hunter!;positive;0.25;0.2
2018-03-05 15:47;200;1039;We're excited to have Emilie Choi joining Coinbase as Vice President of Corporate and Business Developmenthttps://blog.coinbase.com/welcome-emilie-choi-coinbase-vice-president-of-corporate-and-business-development-41ddd59bcbce …;positive;0.1875;0.375
2018-03-01 17:07;182;682;Excited to be part of Proof of Work Common App for those interested in working on open source digital currency protocols. http://commonapp.proofofwork.news/ We are hiring full-time senior engineers to work directly on Bitcoin, Ethereum, Lightning and other protocols.;positive;0.042857142857142864;0.4321428571428571
2018-03-01 02:09;193;759;Excited to have @ zeithq using Coinbase Commerce to accept digital currency into a user-controlled, multi-currency wallet for ZEIT Day SF. https://twitter.com/zeithq/status/968918204637564928 …;positive;0.1875;0.375
2018-02-28 17:44;2;0;We just completed a restore and are working to get out any backlogged transactions. Sorry for the inconvenience.;negative;-0.5;1.0
2018-02-27 23:50;109;434;Customer Support Update — Our 90 Day Plan https://blog.coinbase.com/customer-support-update-b91b9d8e6e46 …;neutral;0.0;0.0
2018-02-24 05:20;5;44;We're investigating this option. Hopefully something we can offer our Canadian customers in the future.;neutral;0.0;0.125
2018-02-24 04:53;310;1115;Excited to see merchants using @ CommerceCB's user-controlled, multi-currency functionality!https://twitter.com/ClothingWhale/status/967237178345472001 …;positive;0.375;0.75
2018-02-23 20:10;10;26;If you know any senior software engineers interested in working on this, we're hiring.;positive;0.25;0.5
2018-02-23 19:08;2;1;Thank you for helping get the word out, Seema.;neutral;0.0;0.0
2018-02-23 18:53;692;1631;Beware of digital currency giveaway scams on Twitter Coinbase WILL NEVER ask you to send us digital currency like these screenshots do. These scams often employ hundreds of bot accounts claiming to have received free digital currency.pic.twitter.com/tcGvi3SB30;positive;0.1;0.2
2018-02-23 18:43;9;128;We would offer native CAD bank transfer buy/sell if there was a Canadian bank willing to work with us.;positive;0.25;0.75
2018-02-23 18:39;3;31;We are monitoring but no immediate plans. Transaction batching is higher priority for us.;positive;0.25;0.5
2018-02-23 18:35;0;6;We're frustrated by this as well. We're hiring hundreds of additional people (after hiring hundreds of people in 2017). Doing this as quickly as possible.;negative;-0.35;0.6
2018-02-23 18:33;0;3;It applies to both.;neutral;0.0;0.0
2018-02-23 18:18;4;51;In progress. Planning to give a public update on these efforts soon.;neutral;0.0;0.06666666666666667
2018-02-23 18:17;600;2442;SegWit is also enabled for Litecoin.;neutral;0.0;0.0
2018-02-23 18:12;225;965;2/2 SegWit has now rolled out to 25% of customers. We are targeting 100% roll out to customers by mid next week.;neutral;0.0;0.0
2018-02-23 18:11;2;108;Will do.;neutral;0.0;0.0
2018-02-23 18:09;892;2532;1/2 Announcing SegWit support on Coinbasehttps://blog.coinbase.com/announcing-segwit-support-on-coinbase-4e51117857c7 …;neutral;0.0;0.0
2018-02-21 23:47;0;2;This is inaccurate information.;neutral;0.0;0.0
2018-02-21 23:47;0;0;We did not issue refunds as we did not cause the incorrect charge. This was the fault of your card issuing bank. Visa/Worldpay made this clear this is not a Coinbase caused issue.;positive;0.10000000000000002;0.3833333333333333
2018-02-21 19:05;0;1;Sorry to hear that. Please contact your card issuing bank. If that hasn't been effective, please share a Coinbase support case number and we can have someone on the team reach out to help resolve.;positive;0.04999999999999999;0.9
2018-02-20 21:04;414;1029;We've seen an increase in the number of fraudulent Twitter accounts claiming to be an official Coinbase account. The only official accounts for Coinbase: @ Coinbase @ CoinbaseSupportpic.twitter.com/PkflysBxhJ;neutral;0.0;1.0
2018-02-20 18:32;2514;8139;Our engineering team has finished testing of SegWit for Bitcoin on Coinbase. We will be starting a phased launch to customers over the next few days and are targeting a 100% launch to all customers by mid next week.;negative;-0.04;0.04
2018-02-17 03:56;2;5;Because the banks/card issuers caused the incorrect charges. Coinbase is not able to fix this—only the bank/card issuer.;negative;-0.25;0.625
2018-02-17 03:48;0;3;We don't have the funds in this case. The banks/card issuers were the ones that made the mistake.;neutral;0.0;0.0
2018-02-17 02:57;2;2;This was your bank/card issuer, not Coinbase. See: https://twitter.com/coinbase/status/964652218832928768 … Apologies for the poor experience. Please reach out to your bank/card issuer about this.;negative;-0.4;0.6
2018-02-17 02:12;0;1;We agree. Apologies for the poor experience. We are pushing all parties involved to resolve as quickly as possible.;negative;-0.2;0.8
2018-02-17 01:53;123;419;To highlight: If you continue to have problems with your credit or debit card account after this reversal period, including issues relating to card fees or charges, we encourage you to ***contact your card issuing bank.***;neutral;0.0;0.0
2018-02-17 01:50;0;0;The next couple of days. Contacting your bank/card issuer should expedite. It's their incorrect charge.;neutral;0.0;0.0
2018-02-17 01:49;0;11;Apologies for the poor experience. If it's not resolved next week, feel free to reach out to us again.;neutral;0.0;0.4666666666666666
2018-02-17 01:47;0;0;https://twitter.com/coinbase/status/964652218832928768 … Please contact your bank/card issuing bank about this issue.;neutral;0.0;0.0
2018-02-17 01:42;0;7;Correct.;neutral;0.0;0.0
2018-02-17 01:40;0;8;Your bank/card issuer incorrectly charged your account. We did not.;neutral;0.0;0.0
2018-02-17 01:38;1;14;Please contact your credit/debit card issuer. They need to resolve. Do not let them push blame on another party.;neutral;0.0;0.0
2018-02-17 01:36;1;3;Please contact your credit/debit card issuer. They need to resolve. Do not let them push blame on another party.;neutral;0.0;0.0
2018-02-17 01:06;412;967;Joint Statement from Visa and Worldpay for Coinbase customers https://blog.coinbase.com/joint-statement-from-visa-and-worldpay-for-coinbase-customers-9a6f2ff5f3b3 …pic.twitter.com/DQLSs1PrU7;neutral;0.0;0.0
2018-02-16 22:30;0;2;We did not receive the money from the extra charges. Your bank or card issuer received a reversal and recharge from the card network. If the reversals did not happen, that's on their side.;neutral;0.0;0.1
2018-02-16 22:22;0;1;Yes.;neutral;0.0;0.0
2018-02-16 22:21;2;0;We are not in control of these charges. We have been informed that this is not an action by Coinbase. We have been told that they will be automatically reversed by your bank or card issuer. Please contact them about this and then contact Coinbase support if the issue persists.;positive;0.1;0.1
2018-02-16 22:18;1;0;We do not collect the cash advance fee—those fees are collected by your card issuer.;neutral;0.0;0.0
2018-02-16 22:14;1;0;Apologies. We are working on a resolution with card networks and card issuers. This was not a Coinbase action. We are pushing the responsible parties to resolve as quickly as possible.;positive;0.10000000000000002;0.5499999999999999
2018-02-16 21:30;0;9;Thanks, Michael. Ultimately, our top priority is to make sure any affected customer get this resolved as quickly as possible.;positive;0.24;0.7177777777777777
2018-02-16 19:11;1;3;Apologies for the poor experience. This was not initiated by Coinbase. It was a card network and issuing bank error. The erroneous charge should automatically reverse soon.;negative;-0.45;0.6
2018-02-16 19:08;0;45;We are working with Twitter to proactively take down these fake accounts. If you are ever unsure, be sure to check for the verified blue checkmark.;negative;-0.03888888888888889;0.5694444444444445
2018-02-16 03:07;1;1;The double charges are Visa. They will be reversed.;neutral;0.0;0.0
2018-02-16 03:01;1;1;This was Visa and your bank/card issuer. We are working to have all of these charges automatically reversed.;neutral;0.0;0.0
2018-02-16 02:59;1;0;This was Visa. Coinbase did not cause these transactions.;neutral;0.0;0.0
2018-02-16 02:58;68;219;4/ If you have been affected by any erroneous charges associated with purchases of digital currency with credit and debit cards, we are encouraging customers to contact their bank or card issuer and ask about the charges. In addition, please contact Coinbase support.;negative;-0.25;0.3
2018-02-16 02:56;71;225;"3/ Coinbase is actively working with major card networks to create a new MCC for digital currency purchases. For the benefit of consumers, we hope that this will not have additional cash advance"" fees. Cards provide wider access to digital currency than just bank accounts.""";positive;0.013106060606060604;0.3109090909090909
2018-02-16 02:53;75;162;2/ Over the last few months, large banks and card issuers requested that card networks change the MCC for purchases of digital currency. Visa changed the MCC for digital currency purchases to a code that allows large banks and card issuers to charge consumers additional fees.;positive;0.03809523809523809;0.1706349206349206
2018-02-16 02:51;383;1157;1/ We have determined that the erroneous credit and debit charges are the result of Visa reversing and recharging transactions. This was not done by Coinbase. We are working with Visa to ensure all affected customers are reimbursed.;negative;-0.5;0.6
2018-02-16 00:30;288;637;Update on credit and debit cards https://blog.coinbase.com/update-on-credit-and-debit-cards-4c08273f0039 …pic.twitter.com/XaZX5IqocD;neutral;0.0;0.0
2018-02-15 23:20;32;99;4/ If you suspect you were incorrectly charged, please contact your bank or card issuer and ask about the charges. After that, please contact Coinbase support.;neutral;0.0;0.0
2018-02-15 22:28;77;218;3/ If you believe you were affected by this issue, please contact support at http://support.coinbase.com . We will be reviewing all card transactions from the last few weeks to ensure any customers affected are notified. We will post on Twitter and our blog with further updates.;negative;-0.06666666666666667;0.22222222222222224
2018-02-15 22:25;69;212;2/ We have identified a solution and any future purchases will not be affected by this issue. We will ensure any customer affected by this issue is fully refunded for any incorrect charge. We expect this to happen for customers automatically through their bank.;neutral;0.0;0.125
2018-02-15 22:23;214;527;1/ We're investigating an issue where some customers recently were charged incorrectly for purchases of digital currency with credit and debit cards. This is related to the recent MCC code change by the card networks and card issuers charging additional fees.;neutral;0.0;0.225
2018-02-14 19:01;218;886;We're excited to be offering merchants the ability to accept multiple types of digital currencies into user-controlled HD wallets.;positive;0.125;0.25
2018-02-14 18:48;2097;4958;Introducing Coinbase Commercehttps://medium.com/@coinbasecommerce/coinbase-commerce-the-easiest-way-for-merchants-to-accept-digital-currency-54ba64966f8d …;neutral;0.0;0.0
2018-02-13 18:55;196;656;Coinbase Weekly Product Update — February 13, 2018https://blog.coinbase.com/coinbase-product-update-february-13-2018-10e88d9d7b2c …;neutral;0.0;0.0
2018-02-08 23:03;0;26;Always open to constructive feedback, Ryan. What would you like to see us do?;neutral;0.0;0.5
2018-02-08 22:57;186;679;We are continuing to hire senior software engineers to do open source work on core protocols: Bitcoin, Ethereum, Lightning Network or any digital currency protocol of interest. Hiring in San Francisco, New York and London. http://coinbase.com/careers/765130 https://twitter.com/brian_armstrong/status/934563254101164033 …;positive;0.04545454545454545;0.3181818181818182
2018-02-08 22:52;286;910;We've seen an increase in the number of fraudulent Twitter accounts claiming to be an official Coinbase account. The only official accounts for Coinbase: @ Coinbase @ CoinbaseSupport Please be mindful to look for the blue verified checkmark and check spelling.pic.twitter.com/TgRRlafdQk;neutral;0.0;0.55
2018-02-08 02:09;0;14;Thanks for the feedback. Passing along to the product team!;positive;0.25;0.2
2018-02-08 02:03;111;470;Recent improvements to identity verification on Coinbase https://blog.coinbase.com/improving-identity-verification-on-coinbase-fd28dde1449a …pic.twitter.com/qPnqynfIGR;neutral;0.0;0.25
2018-02-07 22:19;45;247;Also introducing our new website highlighting our engineering team's open source work: https://opensource.coinbase.engineering/ pic.twitter.com/DyWjUPj3Q1;positive;0.06818181818181818;0.4772727272727273
2018-02-07 22:08;297;1117;Introducing Coinbase Open Source Fund https://engineering.coinbase.com/introducing-coinbase-open-source-fund-116617a1f6ec?gi=f8f3054e874a …pic.twitter.com/E44whk4FGH;neutral;0.0;0.5
2018-02-07 17:35;0;0;Apologies for the poor experience. Do you have a case number? We can investigate.;negative;-0.4;0.6
2018-02-07 02:04;1;1;We actually grew our support team by nearly 10x in 2017.;positive;0.05;0.25
2018-02-07 00:49;0;5;We agree Jeff. We're working to scale our support team as quickly as possible. We're not meeting customer expectations right now. Separately, someone is contacting about your specific issue this afternoon. Apologies for the poor experience.;negative;-0.02857142857142858;0.5651785714285714
2018-02-06 22:34;1;21;We are working on SegWit support for Bitcoin transactions.;neutral;0.0;0.0
2018-02-06 21:57;116;413;Coinbase Weekly Product Update — February 5, 2018https://blog.coinbase.com/coinbase-product-update-february-5-2018-823da36e7595 …;neutral;0.0;0.0
2018-02-06 05:08;2329;4885;Customers using credit cards on Coinbase: the following card issuers are now blocking purchases of digital currency with credit cards. Chase Bank of America Citi Capital One We're encouraging affected customers to switch to debit card or bank account payment methods.;neutral;0.0;0.05
2018-02-06 00:30;2645;7654;Our engineering team has begun the final testing phase of SegWit for Bitcoin on Coinbase. SegWit compatible Bitcoin sends/receives will be available for customers in the next few weeks. We previously wrote about SegWit on our blog:https://blog.coinbase.com/bitcoin-segwit-update-3ab0484e4526 …;positive;0.0066666666666666706;0.33333333333333337
2018-01-22 18:07;152;706;Announcing Tina Bhatnagar as our new Vice President of Operations and Technology https://blog.coinbase.com/introducing-tina-bhatnagar-walking-the-talk-on-customer-service-d7ba6d2fb0dd …pic.twitter.com/RWG2rCEQBl;positive;0.13636363636363635;0.45454545454545453
